{
  "$schema": "https://json-schema.org/draft/2020-12/schema",
  "$id": "https://github.com/JAY5CXSDMY14/evomap/kit/schemas/status.schema.json",
  "title": "evo -p <代号> status --json",
  "description": "单个项目的状态（字段含义见 docs/agent-interface.md 2.1）。",
  "type": "object",
  "required": [
    "schema_version",
    "project",
    "name",
    "count",
    "stuck",
    "gates",
    "items",
    "log"
  ],
  "properties": {
    "schema_version": {
      "const": 1,
      "description": "大版本。只加字段不升；不兼容的改动才升到 2（App 读到不认识的大版本提示更新）"
    },
    "project": {
      "type": "string"
    },
    "name": {
      "type": "string"
    },
    "generated_at": {
      "type": [
        "string",
        "null"
      ],
      "description": "ISO 8601 时间，带时区"
    },
    "last_tick": {
      "type": [
        "string",
        "null"
      ],
      "description": "ISO 8601 时间，带时区"
    },
    "count": {
      "type": "object",
      "additionalProperties": {
        "type": "integer"
      }
    },
    "stuck": {
      "type": "integer",
      "minimum": 0
    },
    "goal": {
      "type": [
        "string",
        "null"
      ]
    },
    "ui_preset": {
      "type": "string"
    },
    "arch_preset": {
      "type": "string"
    },
    "roles": {
      "type": "array",
      "items": {
        "type": "object",
        "required": [
          "role",
          "status"
        ],
        "properties": {
          "role": {
            "type": "string"
          },
          "name": {
            "type": "string"
          },
          "status": {
            "type": "string"
          },
          "label": {
            "type": "string"
          },
          "items": {
            "type": "array"
          },
          "why": {
            "type": [
              "string",
              "null"
            ]
          },
          "until": {
            "type": [
              "string",
              "null"
            ],
            "description": "ISO 8601 时间，带时区"
          }
        },
        "additionalProperties": true
      }
    },
    "stale": {
      "type": "array",
      "items": {
        "type": "object",
        "required": [
          "key"
        ],
        "additionalProperties": true,
        "properties": {
          "key": {
            "type": "string"
          },
          "title": {
            "type": [
              "string",
              "null"
            ]
          },
          "state": {
            "type": [
              "string",
              "null"
            ]
          },
          "raw": {
            "type": [
              "string",
              "null"
            ]
          },
          "reason": {
            "type": [
              "string",
              "null"
            ]
          },
          "since": {
            "type": [
              "string",
              "null"
            ],
            "description": "ISO 8601 时间，带时区"
          },
          "hours": {
            "type": [
              "number",
              "null"
            ]
          },
          "minutes": {
            "type": [
              "number",
              "null"
            ]
          }
        }
      }
    },
    "no_live_path": {
      "type": "array",
      "items": {
        "type": "object",
        "required": [
          "key"
        ],
        "additionalProperties": true,
        "properties": {
          "key": {
            "type": "string"
          },
          "title": {
            "type": [
              "string",
              "null"
            ]
          },
          "state": {
            "type": [
              "string",
              "null"
            ]
          },
          "raw": {
            "type": [
              "string",
              "null"
            ]
          },
          "reason": {
            "type": [
              "string",
              "null"
            ]
          },
          "since": {
            "type": [
              "string",
              "null"
            ],
            "description": "ISO 8601 时间，带时区"
          },
          "hours": {
            "type": [
              "number",
              "null"
            ]
          },
          "minutes": {
            "type": [
              "number",
              "null"
            ]
          }
        }
      }
    },
    "gates": {
      "type": "array",
      "items": {
        "type": "object",
        "required": [
          "id"
        ],
        "additionalProperties": true,
        "properties": {
          "id": {
            "type": "string"
          },
          "question": {
            "type": [
              "string",
              "null"
            ]
          },
          "options": {
            "type": [
              "array",
              "null"
            ],
            "items": {
              "type": "string"
            }
          },
          "kind": {
            "enum": [
              "do",
              "look",
              "ship",
              "external",
              "ask",
              "budget",
              "other"
            ]
          },
          "item": {
            "type": [
              "string",
              "null"
            ]
          },
          "waiting_since": {
            "type": [
              "string",
              "null"
            ],
            "description": "ISO 8601 时间，带时区"
          },
          "confirm": {
            "type": "boolean",
            "description": "第十七轮：在 Orca 端被点了放行类结果、等老板在 evo 入口确认的闸门（试运行）"
          },
          "orca_choice": {
            "type": [
              "string",
              "null"
            ],
            "description": "第十七轮：Orca 端点的是哪个选项"
          }
        }
      }
    },
    "items": {
      "type": "array",
      "items": {
        "type": "object",
        "required": [
          "key",
          "title",
          "state",
          "raw"
        ],
        "additionalProperties": true,
        "properties": {
          "key": {
            "type": "string"
          },
          "title": {
            "type": "string"
          },
          "kind": {
            "type": [
              "string",
              "null"
            ]
          },
          "state": {
            "type": "string"
          },
          "raw": {
            "type": "string"
          },
          "waiting": {
            "type": [
              "string",
              "null"
            ]
          },
          "stalled": {
            "type": "boolean"
          },
          "look": {
            "type": "boolean"
          },
          "round": {
            "type": "integer"
          },
          "manual_checks": {
            "type": "array"
          },
          "state_since": {
            "type": [
              "string",
              "null"
            ],
            "description": "ISO 8601 时间，带时区"
          },
          "no_live_path": {
            "type": "boolean"
          },
          "look_gate": {
            "type": [
              "string",
              "null"
            ]
          },
          "usage": {
            "type": "object",
            "properties": {
              "runs": {
                "type": "integer"
              },
              "minutes": {
                "type": "number"
              }
            }
          }
        }
      }
    },
    "rate_limits": {
      "type": "array"
    },
    "usage": {
      "type": "object"
    },
    "decider": {
      "type": "object"
    },
    "log": {
      "type": "array",
      "items": {
        "type": "string"
      }
    },
    "team": {
      "type": [
        "object",
        "null"
      ]
    },
    "paused": {
      "type": [
        "string",
        "null"
      ],
      "description": "第十七轮：项目暂停原因（state/PAUSED 的内容）；没暂停为 null"
    },
    "tick_running": {
      "type": [
        "object",
        "null"
      ],
      "description": "第十七轮：正在跑的一轮（锁被占）：pid、cmd、since、minutes；没有为 null",
      "additionalProperties": true
    },
    "gates_stale": {
      "type": "boolean",
      "description": "第十七轮：这次没读到 Orca 闸门（status 只读，不新建协调终端）"
    },
    "main_red": {
      "type": "boolean",
      "description": "第十七轮：主线本身测试红了，在途的件等它（不算返工）"
    },
    "model_guard": {
      "type": ["object", "null"],
      "description": "第二十三轮：Multica 项目的施工 / 验收模型核对（ok / code / why / build / verify / at）；Orca 项目为 null；ok=false 时不派施工 / 验收",
      "additionalProperties": true
    },
    "limits": {
      "type": "object",
      "description": "第十七轮：每件上限 decider_reworks / item_hard_runs / item_hard_hours（0 = 关）",
      "additionalProperties": {
        "type": "number"
      }
    }
  },
  "additionalProperties": true
}
